{
  "schemaVersion": "1.0",
  "id": "02_count_magnitude",
  "title": {
    "ar": "المقدار والدعم",
    "en": "Magnitude and support"
  },
  "renderer": "countMagnitude",
  "source": {
    "pdf": "L1_21_Chapters_Illustrated_Study_Edition(1).pdf",
    "physicalPages": [
      10
    ],
    "additionalResearchFigure": false
  },
  "caption": {
    "ar": "يتتبع L₁ مقدار المعاملات، بينما يحصي L₀ غير الأصفار؛ وقد يتساوى مجموع L₁ مع اختلاف الدعم.",
    "en": "L₁ tracks coefficient magnitude while L₀ counts nonzeros; equal L₁ totals can have different support."
  },
  "controls": [
    {
      "key": "value",
      "type": "range",
      "label": {
        "ar": "قيمة العنصر",
        "en": "Entry value"
      },
      "default": 0.6,
      "min": -2,
      "max": 2,
      "step": 0.02
    }
  ],
  "data": {
    "vectors": [
      [
        1,
        0,
        0,
        0
      ],
      [
        0.25,
        0.25,
        0.25,
        0.25
      ]
    ]
  },
  "theme": {
    "source": "https://www.mzfortech.com/research",
    "verified_on": "2026-10-10",
    "source_selector": ".tnh-site",
    "light": {
      "paper": "#f5f2ed",
      "ink": "#111111",
      "accent": "#8b3a2b",
      "pencil": "#756b5e",
      "secondary": "#484039"
    },
    "dark": {
      "paper": "#1e1b18",
      "ink": "#e6ded3",
      "accent": "#d96c5b",
      "pencil": "#b8a691",
      "secondary": "#e6ded3"
    },
    "additional_plot_color": {
      "olive": "#5a7a0a",
      "gold": "#d4a820"
    },
    "evidence": "Research CSS .tnh-site and .tnh-site[data-theme=dark]; olive/gold from site :root."
  },
  "framerMotion": {
    "library": "framer-motion",
    "duration": 0.22,
    "ease": "easeOut",
    "reducedMotion": "user"
  },
  "accessibility": {
    "keyboardControls": true,
    "bilingualLabels": true,
    "textualReadout": true
  }
}
