{
  "schemaVersion": "1.0",
  "id": "12_weight_patterns",
  "title": {
    "ar": "أنماط الأصفار",
    "en": "Zero patterns"
  },
  "renderer": "weights",
  "source": {
    "pdf": "L1_21_Chapters_Illustrated_Study_Edition(1).pdf",
    "physicalPages": [
      32
    ],
    "additionalResearchFigure": false
  },
  "caption": {
    "ar": "قارن عتبة العناصر بعتبة مجموعات الصفوف؛ يختلف حذف اتصال عن حذف مجموعة كاملة. القيم مقربة، وتشير ≈0 إلى وزن صغير غير صفري.",
    "en": "Compare element thresholds with row-group thresholds; deleting one connection differs from deleting a complete group. Values are rounded; ≈0 marks a small nonzero weight."
  },
  "controls": [
    {
      "key": "mode",
      "type": "select",
      "label": {
        "ar": "العقوبة",
        "en": "Penalty"
      },
      "default": "element",
      "options": [
        {
          "value": "element",
          "label": {
            "ar": "عناصر L1",
            "en": "Entrywise L1"
          }
        },
        {
          "value": "group",
          "label": {
            "ar": "مجموعات L2",
            "en": "L2 groups"
          }
        }
      ]
    },
    {
      "key": "lambda",
      "type": "range",
      "label": {
        "ar": "العتبة λ",
        "en": "Threshold λ"
      },
      "default": 0.15,
      "min": 0,
      "max": 0.4,
      "step": 0.01
    }
  ],
  "data": {
    "matrix": [
      [
        1,
        0.2,
        0,
        -0.8,
        0.4,
        0.1
      ],
      [
        0.05,
        -0.08,
        0.1,
        0,
        0.2,
        -0.1
      ],
      [
        0.8,
        0,
        -0.6,
        0.2,
        0.3,
        0
      ],
      [
        0,
        0.15,
        0.2,
        -0.1,
        0,
        0.05
      ]
    ]
  },
  "theme": {
    "source": "https://www.mzfortech.com/research",
    "verified_on": "2026-10-10",
    "source_selector": ".tnh-site",
    "light": {
      "paper": "#f5f2ed",
      "ink": "#111111",
      "accent": "#8b3a2b",
      "pencil": "#756b5e",
      "secondary": "#484039"
    },
    "dark": {
      "paper": "#1e1b18",
      "ink": "#e6ded3",
      "accent": "#d96c5b",
      "pencil": "#b8a691",
      "secondary": "#e6ded3"
    },
    "additional_plot_color": {
      "olive": "#5a7a0a",
      "gold": "#d4a820"
    },
    "evidence": "Research CSS .tnh-site and .tnh-site[data-theme=dark]; olive/gold from site :root."
  },
  "framerMotion": {
    "library": "framer-motion",
    "duration": 0.22,
    "ease": "easeOut",
    "reducedMotion": "user"
  },
  "accessibility": {
    "keyboardControls": true,
    "bilingualLabels": true,
    "textualReadout": true
  }
}
