{
  "schemaVersion": "1.0",
  "id": "13_sparse_storage",
  "title": {
    "ar": "التناثر والتخزين",
    "en": "Sparsity and storage"
  },
  "renderer": "storage",
  "source": {
    "pdf": "L1_21_Chapters_Illustrated_Study_Edition(1).pdf",
    "physicalPages": [
      34
    ],
    "additionalResearchFigure": false
  },
  "caption": {
    "ar": "في مصفوفة 1000×1000 من FP32، يتعادل تخزين CSR مع الكثيف عند نحو 50.1٪ من الأصفار الدقيقة؛ هذه الأحجام الخام لا تتنبأ بزمن التنفيذ.",
    "en": "At 1000×1000 FP32, CSR storage breaks even with dense storage at about 50.1% exact zeros; these raw sizes do not predict runtime."
  },
  "controls": [
    {
      "key": "sparsity",
      "type": "range",
      "label": {
        "ar": "الأصفار الدقيقة %",
        "en": "Exact zeros %"
      },
      "default": 90,
      "min": 0,
      "max": 99,
      "step": 1
    },
    {
      "key": "stage",
      "type": "select",
      "label": {
        "ar": "الخطوة",
        "en": "Stage"
      },
      "default": "storage",
      "options": [
        {
          "value": "small",
          "label": {
            "ar": "أوزان صغيرة",
            "en": "Small weights"
          }
        },
        {
          "value": "zero",
          "label": {
            "ar": "أصفار",
            "en": "Exact zeros"
          }
        },
        {
          "value": "storage",
          "label": {
            "ar": "تخزين",
            "en": "Storage"
          }
        },
        {
          "value": "runtime",
          "label": {
            "ar": "تنفيذ",
            "en": "Runtime"
          }
        }
      ]
    }
  ],
  "data": {
    "rows": 1000,
    "columns": 1000,
    "valueBytes": 4,
    "indexBytes": 4,
    "stages": {
      "small": {
        "ar": "القيم الصغيرة تحتاج إلى عتبة معلنة؛ ليست أصفارا دقيقة.",
        "en": "Small values need a stated threshold; they are not exact zeros."
      },
      "zero": {
        "ar": "التقليم أو التحسين القريب يستطيعان صنع أصفار؛ التنسيق الكثيف يحتفظ بمواضعها.",
        "en": "Pruning or proximal updates can create zeros; dense storage retains their slots."
      },
      "storage": {
        "ar": "تنسيق متناثر يخزن القيم والفهارس؛ التحول البنيوي يعيد بناء أشكال الطبقات.",
        "en": "Sparse formats store values and indices; structural changes rebuild layer shapes."
      },
      "runtime": {
        "ar": "السرعة تعتمد على الجهاز والنواة والحجم؛ تحتاج إلى قياس مستقل.",
        "en": "Speed depends on hardware, kernel, and workload; it requires an independent benchmark."
      }
    }
  },
  "theme": {
    "source": "https://www.mzfortech.com/research",
    "verified_on": "2026-10-10",
    "source_selector": ".tnh-site",
    "light": {
      "paper": "#f5f2ed",
      "ink": "#111111",
      "accent": "#8b3a2b",
      "pencil": "#756b5e",
      "secondary": "#484039"
    },
    "dark": {
      "paper": "#1e1b18",
      "ink": "#e6ded3",
      "accent": "#d96c5b",
      "pencil": "#b8a691",
      "secondary": "#e6ded3"
    },
    "additional_plot_color": {
      "olive": "#5a7a0a",
      "gold": "#d4a820"
    },
    "evidence": "Research CSS .tnh-site and .tnh-site[data-theme=dark]; olive/gold from site :root."
  },
  "framerMotion": {
    "library": "framer-motion",
    "duration": 0.22,
    "ease": "easeOut",
    "reducedMotion": "user"
  },
  "accessibility": {
    "keyboardControls": true,
    "bilingualLabels": true,
    "textualReadout": true
  }
}
