{
  "schemaVersion": "1.0",
  "id": "05_regularization_path",
  "title": {
    "ar": "مسار التنظيم",
    "en": "Regularization path"
  },
  "renderer": "path",
  "source": {
    "pdf": "L1_21_Chapters_Illustrated_Study_Edition(1).pdf",
    "physicalPages": [
      19
    ],
    "additionalResearchFigure": false
  },
  "caption": {
    "ar": "مثال متعامد: المعاملات Sλ(a) تتناقص ثم تختفي؛ مسار المعاملات ليس ترتيب أهمية إحصائية.",
    "en": "Orthogonal example: Sλ(a) coefficients shrink and vanish; a coefficient path is not a statistical importance ranking."
  },
  "controls": [
    {
      "key": "lambda",
      "type": "range",
      "label": {
        "ar": "قوة التنظيم λ",
        "en": "Penalty λ"
      },
      "default": 0.4,
      "min": 0,
      "max": 2.2,
      "step": 0.02
    }
  ],
  "data": {
    "preferred": [
      2,
      -1,
      0.4
    ]
  },
  "theme": {
    "source": "https://www.mzfortech.com/research",
    "verified_on": "2026-10-10",
    "source_selector": ".tnh-site",
    "light": {
      "paper": "#f5f2ed",
      "ink": "#111111",
      "accent": "#8b3a2b",
      "pencil": "#756b5e",
      "secondary": "#484039"
    },
    "dark": {
      "paper": "#1e1b18",
      "ink": "#e6ded3",
      "accent": "#d96c5b",
      "pencil": "#b8a691",
      "secondary": "#e6ded3"
    },
    "additional_plot_color": {
      "olive": "#5a7a0a",
      "gold": "#d4a820"
    },
    "evidence": "Research CSS .tnh-site and .tnh-site[data-theme=dark]; olive/gold from site :root."
  },
  "framerMotion": {
    "library": "framer-motion",
    "duration": 0.22,
    "ease": "easeOut",
    "reducedMotion": "user"
  },
  "accessibility": {
    "keyboardControls": true,
    "bilingualLabels": true,
    "textualReadout": true
  }
}
