{
  "schemaVersion": "1.0",
  "id": "04_constraint_geometry",
  "title": {
    "ar": "موضع التماس",
    "en": "Constraint contact"
  },
  "renderer": "geometry",
  "source": {
    "pdf": "L1_21_Chapters_Illustrated_Study_Edition(1).pdf",
    "physicalPages": [
      14
    ],
    "additionalResearchFigure": false
  },
  "caption": {
    "ar": "غيّر t لترى الحلين المحسوبين للخسارة نفسها؛ قد ينتقل حل L1 من رأس إلى ضلع.",
    "en": "Change t to see both computed solutions for the same loss; the L1 optimum can move from a vertex to an edge."
  },
  "controls": [
    {
      "key": "budget",
      "type": "range",
      "label": {
        "ar": "الميزانية t",
        "en": "Budget t"
      },
      "default": 1.2,
      "min": 0.2,
      "max": 2.5,
      "step": 0.02
    }
  ],
  "data": {
    "center": [
      2,
      0.3
    ],
    "curvature": [
      1,
      2
    ]
  },
  "theme": {
    "source": "https://www.mzfortech.com/research",
    "verified_on": "2026-10-10",
    "source_selector": ".tnh-site",
    "light": {
      "paper": "#f5f2ed",
      "ink": "#111111",
      "accent": "#8b3a2b",
      "pencil": "#756b5e",
      "secondary": "#484039"
    },
    "dark": {
      "paper": "#1e1b18",
      "ink": "#e6ded3",
      "accent": "#d96c5b",
      "pencil": "#b8a691",
      "secondary": "#e6ded3"
    },
    "additional_plot_color": {
      "olive": "#5a7a0a",
      "gold": "#d4a820"
    },
    "evidence": "Research CSS .tnh-site and .tnh-site[data-theme=dark]; olive/gold from site :root."
  },
  "framerMotion": {
    "library": "framer-motion",
    "duration": 0.22,
    "ease": "easeOut",
    "reducedMotion": "user"
  },
  "accessibility": {
    "keyboardControls": true,
    "bilingualLabels": true,
    "textualReadout": true
  }
}
